start	end	text
2157020	2162520	あって大変だったんだけどなんかそのニュース以降は何にもなかったね
2162520	2167700	怖くねいやめっちゃ怖いですねやっぱりやっぱりなんか起きてるんだなんか起きてる
2170700	2172620	めっちゃ怖いなと思って
2172620	2173700	それもあったから
2173800	2179180	ずっとドキドキはしてたんだけどまあ無事リール行ったし無事パリに帰ってきたし
2179180	2183400	あのシャルルドゴール空港からの行き来も無事なんとかいろいろ
2183400	2188220	やっぱちっちゃい子供いるからさうちとかちょっと怖くて
2188220	2197180	でもそうですねパリとかその空港とかをめっちゃ警備するのはできますけどそのリール行く途中とかになると
2197180	2197900	そうよ
2197900	2198840	きついですよね
2198840	2202600	さすがに無理だろって思う
2202600	2203780	なんかされたら終わりだよ
2203800	2206800	あるなと思ってずっとドキドキしてた俺
2206800	2214340	それはやっぱ神経やられるよね疲れたわ
2214340	2220420	荷物持つとかもそうだけどさ変な人子供の近くに来ないかなとか
2220420	2223540	嫁見てるからいいとか言えないからさ
2223540	2224020	そうですね
2224020	2227440	女の子3人だからさ言っちゃうと
2227440	2230800	なんか連れて帰るには余裕じゃんと思って
2230800	2232640	怖いと思って
2232640	2233780	ずっとドキドキしてたら俺はね
2233800	2234800	ちょっと目見張ってたわ
2234800	2237920	まあまあ無事ね
2237920	2240300	まあまあそのくらい安全で
2240300	2248060	パリの市内から陸上競技場のところまでタクシーでバーっと行って
2248060	2253540	その時ちょっと結構怖いエリアみたいなのも若干通ったんですよね
2253540	2257140	明らかにうわーこの辺危なそうみたいな
2257140	2260120	ロンドンから来てたお友達が教えてくれて
2260520	2263620	この辺ちょっと普段歩いちゃ絶対ダメなとこですね
2263800	2264280	みたいな
2264280	2266080	そう教えてくれて
2266080	2270060	でも確かにそうかもみたいな
2270060	2272860	普段は絶対来ちゃダメだねみたいなこと言いながらさーっと
2272860	2274900	タクシーだから全然抜けて行けたんだけど
2274900	2279780	そんなこんな行って陸上競技場着いたんですよ
2279780	2282120	陸上競技場着いてから
2282120	2286120	競技場の近くってタクシーの乗り降りしちゃダメで
2286120	2289800	ちょっと離れたとこに降ろされるんですよ
2289800	2292780	で降ろされてから橋渡ってどうのこうのみたいな
2292780	2293780	ちょっとだけ気持ち悪くて
2293800	2295120	危なそうなとこ通って
2295120	2297860	ちょっと一番その時ドキドキしたね
2297860	2300960	でもそれ人いっぱいいるんでしょ
2300960	2304060	まあまあいるけどちょっと夕方近いし
2304060	2306600	ちょっと遅れて行ってるから
2306600	2307380	そうそうそうそう
2307380	2310120	まばらだったから
2310120	2314260	そうそのロンドンの友達も女の方なので
2314260	2319720	女性4人プラス女性4人というか女性2人子供2人俺だみたいな感じなので
2319720	2322380	怖えなーと思いながら
2322380	2323780	あの時ちょっとドキドキしたんですよ
2323800	2324580	ドキドキしたね
2324580	2328820	であーもう目の前だ陸上競技場着いたーって今から
2328820	2332540	荷物検査だみたいな時にパッて横見たら
2332540	2335380	すごいでかい人たちが3人おって
2335380	2337780	え?と思ったら
2337780	2340600	あのカナダスペイン戦でさ
2340600	2344380	ちょっと話したフォワードセンターのイブシギンの
2344380	2347120	オリニクとパウエルっていう選手が現れて
2347120	2347880	おー
2347880	2348960	え?と思って
2348960	2351040	ちょっと待ってくれ
2351040	2353780	おととい見たぞ
2353800	2357260	オリニクって俺言ったら
2357260	2359100	こっち見て笑顔で
2359100	2359820	イエースって
2359820	2363160	うーわーと思って
2363160	2366060	え?って後ろ見たらパウエルいるから
2366060	2368080	もちろん僕は知ってるから
2368080	2369860	パウエルみたいな
2369860	2372800	なんかこうニコニコしてて
2372800	2374720	うわやばいやばい
2374720	2379080	やばいでももちろんめっちゃでかいの2m級の選手たちなので
2379080	2380800	体めっちゃでかくて
2380800	2383300	でもう俺ちょっと
2383300	2383640	キンって言ったら
2383640	2383780	キンって言ったら
2383800	2385200	緊張しまくっちゃって
2385200	2386420	で俺
2386420	2388300	あおとといの試合見たよと
2388300	2391360	ちょっとセルフィーさせてくれないかだけ言って
2391360	2394120	そのパウエルっていう選手と撮ったんね
2394120	2395460	おーいいっすね
2395460	2396820	そうパウエルとは撮れたけど
2396820	2397960	オリニクと撮れなくて
2397960	2399440	で俺もう
2399440	2401740	本当に緊張しちゃって
2401740	2402920	声出なかったんだけど
2402920	2403480	その時
2403480	2405960	あのロンドンから来てくれた
2405960	2409620	まあナメちゃんの吉川ちゃんっていう子が来てくれてたんだけど
2409620	2411220	吉川ちゃんって
2411220	2413340	あの2人の選手は
2413340	2414560	すごい選手だと
2414560	2416740	俺のことはいいから
2416740	2419620	写真を撮らせてくれと
2419620	2422120	あのって言ったらもうロンドンの吉川ちゃん
2422120	2423200	なんも知らないから
2423200	2425540	全然任せてくださいとか言って
2425540	2427140	あと全員に声かけて
2427140	2429460	あのあの人がすごく
2429460	2430780	君たちのファンなんだと
2430780	2433440	一緒に写真撮ってくれないかってお願いして
2433440	2434840	今ちょっとLINE送ったんですけど
2434840	2436860	家族写真を
2436860	2438880	心よく撮っていただきまして
2438880	2441760	NBA選手3人と
2443340	2447640	俺すっごいびっくりしちゃって
2447640	2449420	口に手当てちゃってるじゃないですか
2449420	2449920	いやもうね
2449920	2451420	びっくりして
2451420	2455620	さっきの緊張と緩和
2455620	2457660	陸上競技場の時
2457660	2459220	俺めっちゃ緊張してたんだよ
2459220	2460880	大丈夫かなとか
2460880	2463460	降りてからなんかあったらまずいなとか
2463460	2465020	思って
2465020	2466980	やってた時に横から
2466980	2469340	NBA選手バー出てきちゃった
2469340	2470120	もんだから
2470120	2472220	俺本当に緊張してて
2472220	2472340	うん
2472340	2472460	うん
2472460	2472540	うん
2472540	2472620	うん
2472620	2472640	うん
2472640	2472660	うん
2472660	2473140	うん
2473140	2473160	うん
2473160	2473260	うん
2473260	2473280	うん
2473280	2473320	うん
2473340	2473540	,
2473540	2473560	うん
2473560	2473580	うん
2473580	2473600	うん
2473600	2473620	うん
2473620	2473640	うん
2473640	2475200	もう何にも英語出てこなくて
2475200	2478040	よし母ちゃんいてくれてよかった
2478040	2480720	すごいなんか
2480720	2481680	なんか
2481680	2483740	サイズ感が
2483740	2485700	すごいっすねおかしい
2485700	2486460	バグるよね
2486460	2488600	俺結構でかいじゃん
2488600	2490700	そう星川さんめっちゃでかいはずなのになんか
2490700	2492460	俺全然ちっちゃくね
2492460	2496400	子供みたいに見えるんだけどさらにもっとちっちゃい子供もいて
2496400	2497860	うちの娘がね
2497860	2498140	そうそう
2498140	2500780	でこの選手たちは
2500780	2503200	もう入りきってないっすもんね
2503200	2504360	あそうそう写真の枠に
2504360	2508100	はい
2508100	2510040	えーいい写真
2510040	2512440	いや嬉しかったなー
2512440	2513680	めっちゃ嬉しかった
2513680	2515500	やったーと
2515500	2517540	超嬉しい
2517540	2520240	いやーすごいいろんな偶然が
2520240	2521540	いやそうそうそう
2521540	2522620	起きてますね
2522620	2528020	6時開催の中で子供たち寝かしてのんびり行ったらそうなったとかね
2528020	2530600	で結構裏から入ったんだけどさ
2530600	2532420	まさか
2532420	2532620	いやー
2533200	2536720	ドワイトパウェルとウリニクがいるとは
2536720	2540700	これ3人ともカナダの選手ですか
2540700	2541560	そうですそうです
2541560	2543300	カナダ代表で
2543300	2547160	その先日リールでの予選で全部勝ってきて
2547160	2548720	で次の日高に
2548720	2555580	ベスト4決めとかがパリで行われるからそっちに帰ってきてたって感じ
2555580	2557940	そうなんだ後半はパリでやってたんですね
2557940	2561300	そうそうそうでその隙間の時に陸上見に来たって感じ
2561300	2563180	いやもうやっぱり
2563200	2564880	やっぱでかいから
2564880	2569260	俺らの時ってもうその時間が時間なので全然周り人いなくて
2569260	2573480	でもちょっと歩いただけで結構やっぱ周りがざわつくよね当たり前だけど
2573480	2577220	目立ちますよねこのサイズさすがに
2577220	2578340	めっちゃ目立つよね
2578340	2581360	でちょっと面白かったのは
2581360	2583200	嫁全く知らないのに
2583940	2586440	俺がパウェルウリニクとかばっか言ってるから
2586440	2590240	パウェルとか言って一緒にパウェルとツーショット撮ってた
2590240	2593040	この後に
2593040	2595020	そう知らんやろって
2595020	2599680	ちゃっかりしてるなと思って
2599680	2602240	4枚ぐらい写真撮ってもらったんだけど
2602240	2604760	俺ずっと手に口を手に押さえちゃってた
2604760	2607100	いい写真なかった1個も
2607100	2609880	もう無理だった
2609880	2613160	いやーすごかったよ
2613160	2618000	っていうのが陸上競技場入る
2618000	2619540	入るまでの話ですね
2619540	2620240	入るまでの
2623040	2624360	いやすごいな
2624360	2625780	すごいですねいいな
2625780	2627820	なんかもう本当にいろいろあって
2627820	2628940	もう疲れちゃったよ
2628940	2632160	で陸上競技場行ったら
2632160	2634280	なんか前から十何席目みたいで
2634280	2635480	あーそうですねいい席
2635480	2637680	あー写真来た
2637680	2639620	すごい確かにいい席で
2639620	2642080	このスタートほんと真横ですね
2642080	2643580	こんなとこさ
2643580	2646180	生きてて座れることあると思って
2646180	2648880	これ確かにJOCが座りそうなとこですね
2648880	2649580	でしょ
2649580	2651820	隣の人JOCだよ
2651820	2652920	ふふふ
2653040	2658560	で俺らはそこやったんだけど
2658560	2661580	あのアレックスさんとケンちゃんだけ
2661580	2663600	ちょっと違う席だったんですね
2663600	2665020	あーそうなんだ
2665020	2666520	ちょっと取り方の問題もあって
2666520	2670020	でアレックスとケンちゃんは
2670020	2673020	あのー
2673020	2675480	えーっとちょっと説明が難しいんですけど
2675480	2679120	えーこうさみんな選手が
2679120	2681880	用意ってこう並ぶ
2681880	2682940	ちょっと待って
2683040	2684940	説明俺下手だなごめんなさいねちょっと
2684940	2688060	あのー100m走の選手が
2688060	2690380	走るときにこう一列で並ぶじゃないですか
2690380	2691520	スタート前に
2691520	2694020	でそうすると
2694020	2695280	真後ろの方に
2695280	2697640	お客さんってちょっと見えるじゃないですか
2697640	2698800	ん?
2699300	2700440	真後ろにお客さん
2700440	2703600	そこの前から
2703600	2705620	二列目にケンちゃんいるんですよ
2705620	2708100	あそっちはそっちでむちゃくちゃいい席だったんですね
2708100	2710600	そっちはそっちでめちゃめちゃいい席取れたんですね
2710600	2711920	へー
2711920	2712840	そっちはもらって
2713040	2715580	僕らはもらった
2715580	2717860	ケンちゃんとアレックスさんは
2717860	2721420	その俺らがもらえるって分かって席いいぞってなったんで
2721420	2723740	100mの
2723740	2726240	いい席はどこかっていうのを
2726240	2727820	バーでみんなで調べたんよ
2727820	2729960	でこの辺だったら
2729960	2731500	すごいいい席っぽいぞとか
2731500	2734340	そこで前から何番目いくらだみたいな
2734340	2736920	で俺ら5人席もらってるから
2736920	2738780	7人で
2738780	2740620	その2席買ったって
2740620	2742100	考えれば安いみたいな
2743040	2745060	とんでも理論をみんなで冷やして
2745060	2747960	だって5席もらってるからいい席
2747960	2749060	うん
2749060	2751180	じゃああの
2751180	2753860	1人15万ぐらいの席も
2753860	2754860	いいんじゃねみたいな
2754860	2758120	7で割ればみたいな
2758120	2759180	っていうので
2759180	2762220	今写真送ったじゃないですか
2762220	2764000	それのパリの
2764000	2765960	Pの上に
2765960	2768980	ケンちゃんと帽子かぶってるアレックスさんがいるんですよ
2768980	2770300	赤い服で
2770300	2772580	赤い2人がこう
2772580	2773960	赤い服見えた
2773960	2774460	これか
2774460	2777640	っていう席にケンちゃんがいます
2777640	2780200	1席15万の席
2780200	2780860	はい
2780860	2783460	もうちょっとしたかもな
2783460	2786200	でも買えるんすね
2786200	2788580	リセールのやつでちょうど出てて
2788580	2790340	もう買っちまえつって
2790340	2792320	いやこれなかなか
2792320	2793460	いい席ですね
2793460	2796300	めっちゃ面白かった
2796300	2799860	これ決勝ですか
2799860	2801460	決勝っす
2801460	2801700	はい
2801700	2801860	はい
2802580	2803580	優勝した
2803580	2806180	100m決勝の
2806180	2808900	いやー
2808900	2809420	疲れた
2809420	2812340	話しててあれですけど
2812340	2814920	楽しかったけどやっぱ緊張したし
2814920	2816720	子供をちゃんと連れていけるかという
2816720	2818340	やっぱ親としての不安もあり
2818340	2819340	うん
2819340	2821320	いやこんだけいろんなこと起きてたら
2821320	2823220	まあそれは楽しいけど疲れますね
2823220	2824680	くっそ疲れましたね
2824680	2829280	ピロセスズダーがなんか昔のことのようでしょ
2829280	2830500	そうですね
2830500	2832540	もう忘れてましたもん
2832580	2833580	ピロセスズダーでしょ
2833580	2835460	ピロセスズダーとかさ
2835460	2841260	いやなので子供たちも結構オリンピックを楽しめたというか
2841260	2842900	オリンピックについてこう
2842900	2843980	なんだろう
2843980	2846320	その昔ってどんなオリンピックだったのとか
2846320	2846760	うん
2846760	2848600	開会式見たいとか
2848600	2849260	うん
2849260	2851140	なんかそういうこう少し
2851140	2854740	あの興味が湧いてくれて嬉しかったですね
2854740	2856900	あれ開会式って見れたんすか
2856900	2858080	ああいやいや見てない見てない
2858080	2859020	なんか動画で
2859020	2861780	でも同じさ競技場だからここいたねとかさ
2861780	2864040	この辺の席だったじゃんとかさ
2864040	2866680	結構いい話ができるというか
2866680	2868760	うん確かにね体験してるから
2868760	2871020	そうそうリアリティを持って会話できるから
2871020	2872260	うん
2872260	2874620	違うよねそこは
2874620	2875060	うん
2875060	2877860	下の子にフランスの一番の思い出何
2877860	2881540	リールで乗った遊園地の
2881540	2883640	ジェットコースターって言ってた
2883640	2887480	いいっすね
2887480	2889860	そうだそうこなくっちゃ
2889860	2890300	って思って
2890300	2891580	ははははははは
2891780	2895560	気づくのは十何年後かなみたいな
2895560	2897360	二十年後かみたいな
2897360	2898940	そういうもんよね
2898940	2899680	ね
2899680	2906280	まあそんなこんなで次の日はルーブル美術館行ってとか
2906280	2908520	ああルーブルいいっすね
2908520	2909140	はい
2909140	2910040	ニケ見て
2910040	2914000	まあまあもうベタなのしか見てないけどね時間もないし
2914000	2917280	ルーブル見てあとはモナリザ見てとか
2917280	2919700	民衆を導く女神見てとか
2919700	2920060	うん
2920060	2921000	はい
2921000	2921400	はい
2921780	2926580	うんその辺行ってちょっと有名なとこのご飯行ってオイスター食ってとか
2926580	2928780	いいなあオイスターもあるんだ
2928780	2930740	おいしかったあとエスカルゴとか
2930740	2932720	ああエスカルゴね確かに
2932720	2933640	ご飯おいしかったね
2933640	2936380	ご飯がおいしかったなフランス
2936380	2937180	ああ
2937180	2939700	ロンドンがほんとおいしくなかったから去年
2939700	2941080	ははは
2941080	2943700	そうなんだやっぱりイギリスっておいしくないんですね
2943700	2947580	うんロンドンおいしくない上に高かって
2947580	2951760	フランスでまあまあこんなもんかってこうやっぱ日本に
2951780	2955940	結構日本に近い日本よりちょっと高いかなぐらいの感じだったから
2955940	2957780	あえでもそんなもんなんですね
2957780	2961260	うんなんかすごいうわあクソ高えって思うことはあんまなかった
2961260	2964380	まあ水とかは高いけどね普通のものの基本値段が
2964380	2969920	でもまあまあ旅行でこのぐらいかかるのはしゃあねえかって思える許容範囲だったなっていう感じ
2969920	2974740	ワインとかねめっちゃ安いって言います
2974740	2976180	あそうそうそうそうそうそう
2976180	2980040	まあでもこんだけ疲れてたから俺ほとんどお酒飲めなくてさ
2980040	2980420	うん
2980420	2981580	うん
2981780	2985120	嫁はちょっと飲んだり白ワイン飲んでとかだったけど
2985120	2988260	俺一回だけだったのこの旅でビール飲んだの
2988260	2988900	あそうですか
2988900	2991120	うん飲んだら死ぬと思った
2991120	2995200	マジで起きれなくていろんなことが終わるし
2995200	2996500	まあ確かにね
2996500	2999540	体調崩すわけにいかないしさ
2999540	3002420	その後俺エストニアとフィンランドあるんだぞと
3002420	3003500	確かに
3003500	3003920	うん
3003920	3008460	僕昔イタリアに旅行行ったことがあるんですけど
3008460	3011360	その時もうワインが死ぬほど安くて
3011360	3011760	毎日飲んでたんですよ
3011780	3013240	毎晩毎晩飲んでたんですよ
3013240	3015920	そしたら毎晩毎晩体調悪くて
3015920	3017720	毎晩じゃない毎朝毎朝
3017720	3020280	いやそうなるよ
3020280	3020540	うん
3020540	3024100	でもなんか最初それよく気づいてなくて
3024100	3028620	単にまあ旅行先だからちょっと疲れてるのかなみたいな感じだったんですけど
3028620	3030980	いや酒やと思って
3030980	3035780	後半酒を控えましたね
3035780	3036320	そしたら
3036320	3038080	そしたらあの調子良くなりました
3038080	3041760	でも本当に確かに水高いんですよ
3041780	3042320	高いですよね
3042320	3046020	ワインよりそのスティールウォーター頼む方が高い
3046020	3047500	まあさすがに高いことはないかな
3047500	3049600	まあでも同じぐらいするっていう感じでしたよね
3049600	3055720	少なくとも安くて2ユーロとかだったから300円とかは余裕でしたし
3055720	3059300	場所によっては5ユーロするとこ全然あったから
3059300	3063520	そうそうレストランで頼むとね結構5ユーロぐらいするしてたから
3063520	3064960	800円ぐらい全然いくよね
3064960	3065560	ね
3065560	3067980	ワイングラスワインも同じぐらいって感じ
3067980	3068860	そうそうそうそう
3068860	3071100	それはワイン飲むわって思ってたんですけども
3071100	3071760	最後の方は
3071780	3073220	あかんよ
3073220	3073440	うん
3073440	3077080	いやでも楽しかったっすよ本当に
3077080	3077940	いやいいっすね
3077940	3079520	なかなか
3079520	3083220	あのアレックスさん2回今までオリンピック行ってた中で
3083220	3085500	今回が一番楽しかったって言ってた
3085500	3087380	えーそれは嬉しいっすねなんか
3087380	3089120	そう今まで一人で行ってたりとか
3089120	3092340	現地で友達できたりとかってはあったろうけど
3092340	3097720	やっぱ友人と行くってその楽しみ方がこう一気に倍増するじゃないですけど
3097720	3098620	うん
3098620	3101760	なんか同じ喜びを分かち合える人がいるっていうのは
3101780	3104100	すごい幸せなことなんだなって
3104100	3106960	生きながら感じたとも言ってたし
3106960	3108100	僕もそう思ったので
3108100	3109700	いやこれは
3109700	3112340	秀滝を4年後連れてくしかない
3112340	3114800	まあしかもさなんかその
3114800	3118020	その中だけで楽しむのも楽しいっすけど
3118020	3120240	そのさっき言ってたみたいに写真で
3120240	3123340	そのね他の外国人との交流もあってっていうのは
3123340	3125280	それはなんかすごい
3125280	3129120	でもなかなかすごいっすよね難しいというか
3129340	3131620	グループで行っちゃうとグループだけになり
3131620	3131760	そういう感じで
3131760	3135960	そうだし一人で行ったらもちろんそのいろんな人と関われそうですけど
3135960	3137420	それは両方
3137420	3140820	一人でもさ難しいと思うよやっぱり
3140820	3141080	うん
3141080	3146160	今回本当に正直ずるいけどけんちゃんとも同じこと話したんだけど
3146160	3148680	子供のおかげだねみたいなのがあった
3148680	3154120	ちっちゃい子が変な仮面かぶってたらやっぱ写真撮るよ
3154120	3157320	なるほどね
3157320	3160880	これは本当に娘のおかげでしたね
3160880	3161740	いいですね
3161760	3164180	海外旅行にやっぱ子供連れてった方がいいんですね
3164180	3168160	そうですねなんか使うと言ったらすごい言葉が悪くなるんですけど
3168160	3172940	なんか結果的にすごいあの楽しい時間を
3172940	3176500	むしろ僕たちがもらったなっていう風に
3176500	3177920	思う機会でしたね
3177920	3180520	なんか多分去年の旅行の時も
3180520	3183100	そういうことを言ってた気がしますね
3183100	3184380	確かに
3184380	3185840	そうそうそうそう
3185840	3186520	本当そう
3186520	3187920	なんかそのせいか
3187920	3190540	100m終わって
3190540	3191720	帰ろう帰ろう
3191720	3194080	みんなで歩いてたら
3194080	3197940	日本からNHKの取材をされました我々
3197940	3201900	まだいろいろあるのかよっていう
3201900	3203120	まだあったか
3203120	3203820	まだあった
3203820	3205400	NHKの取材されて
3205400	3207700	ニュースナインかな
3207700	3210960	今写真送ったんですけど
3210960	3214420	ケンブリッジアスカさんが
3214420	3216180	準決勝走ってて
3216180	3219340	その時間僕らオリニックと写真撮ってたんですよね
3219340	3221700	見てなかったんかいみたいな
3221720	3224740	俺そんななんかそういうの出たくないから
3224740	3226780	一歩引いてみんなの写真撮ったりしてて
3226780	3230240	子供たちにさやっぱ
3230240	3233920	100m競技どうだったみたいな聞いたら
3233920	3236040	うちの娘が早かったとか言ってさ
3236040	3237860	そういうことじゃないですか
3237860	3239980	そうですねそれを使いたいですからね
3239980	3240640	そうそうそうそう
3240640	3242980	なんかやっぱ子供のそういうの欲しいんだろうなと思って
3242980	3246260	これおもやされたんですか
3246260	3246960	いやわからん
3246960	3249280	確かにそっちいたらわからないです
3249280	3250480	全然知らない
3250480	3251000	と思って
3251720	3255640	でもなんかこういうのも含めてさ
3255640	3259420	パリの場所にも
3259420	3261380	日本人そんな多くなかったんかね
3261380	3263640	バスケの日本の試合は
3263640	3264560	当然多かったけど
3264560	3267680	100mの時日本人全然見なくて
3267680	3268300	そうですか
3268300	3271180	ちょっとまあ数人いたかな
3271180	3273180	っていう感じだし競技場広くて
3273180	3275160	たくさん人会う中ではやっぱ全然いなかった
3275160	3277240	そこで行くと
3277240	3278400	僕らが団体でさ
