start	end	text
2085680	2100240	日本の場合って関東大震災で結構なくなったし、戦争でも結構やっぱり一気になくなったりしてるからさ、どうしても建物自体古かったとしても1950年以降みたいな感じになりがちだから。
2100320	2100840	そうですよね。
2101220	2103080	うーん。そんな不利のないよね。
2103300	2109300	ヨーロッパとかね、アメリカとかは結構その石造りだったり、結構長持ちするものを作りますよね。
2109500	2110080	そうだね。
2111280	2113160	まあ、でもそうか、地震の有無で。
2113340	2120160	まあ、そうか、お金かけて長持ちするやつ作っても、まあ壊れちゃうわけか。
2120360	2132320	うーん。比較的ね、リールってなんか、僕がそのバスケで見たフランスの都市のリールっていうのは、あの、結構、えっと、隣のベルギーと国境が近くて。
2132500	2132620	うん。
2132620	2138500	で、あの、第二次世界大戦の時に結構ドイツ側が来た地域の一つだったらしいのよね。
2139800	2143320	その割には、なんでしょう、あの、石畳のこと。
2143340	2147820	でも、なくなっちゃったところはやっぱり新しいものが多かったりね。
2148040	2148060	うん。
2149100	2153360	あの、映画にもなったダンケルクって覚え、なんか聞いたことない。
2153440	2155000	あー、ダンケルクってなんか映画ありましたね。
2155000	2161340	映画になったよね。あの、イギリスの人たちの兵士さん何十万人を逃がすことに成功したみたいな。
2161360	2161460	うん。
2162040	2165780	そう、ドイツにやられてる時みたいな。結構そこが近い都市なので。
2166000	2166200	うん。
2166960	2167200	うん。
2167200	2167280	うん。
2168120	2169260	でもやっぱそういうのも。
2169760	2170000	うん。
2170000	2170060	うん。
2170060	2170080	うん。
2170080	2170100	うん。
2170100	2170120	うん。
2170120	2170140	うん。
2170140	2170200	うん。
2170200	2170260	うん。
2170260	2170280	うん。
2170280	2170300	うん。
2170300	2170400	うん。
2170400	2170540	うん。
2170540	2170600	うん。
2170600	2170620	うん。
2170620	2172620	うん。
2172620	2173620	うん。
2173620	2173700	うん。
2173700	2173760	うん。
2173760	2173800	うん。
2173800	2173820	うん。
2173820	2173920	うん。
2173920	2174040	うん。
2174040	2174500	うん。
2174500	2174600	うん。
2175120	2179260	それでも同じような石畳だと、なんか昔のもの残ってる感じもするし。
2179300	2179420	うん。
2180380	2189120	なかなか、うん。壊す、壊し、壊れてしまう。あんまり、はい、建物だと難しいね。
2189360	2199140	そうなんですよね。京都とかも結構老舗のお店とか、まあお寺とかも結構古いの多いですけど、建物自体は建て替わってることが多いですからね。
2199240	2199460	うん。
2199580	2200600	なんかそんなイメージある。
2200620	2202620	はい。
2204280	2217040	あとは、結構そんな感じかな。タルトゥ行ってスパ行ったりとかしましたが、サウナ的には、はい、なんか結構去年行ったところをこう、はい、同じように行きながらみたいな。
2218060	2220040	エストニアは何泊ぐらいしたんですか?
2220360	2222760	エストニアは合計で5日かな。
2223260	2223480	うん。
2223820	2225360	5日?6日?みたいな感じ。
2225560	2225620	うん。
2225620	2225680	うん。
2225680	2225740	うん。
2225740	2225760	うん。
2226020	2226180	うん。
2226180	2230380	で、最終日フィンランドに行って、フィンランドで。
2230620	2254280	で、朝、昼ぐらいにフィンランド着いて、次の日の夕方発みたいな感じなので、まあ1日ちょいフィンランドで行ってみたいな感じだったんですけど、フィンランドでは特に、あの、ヘルシンキの街に行くには、まあ30分ぐらいで行けるんですけど、ちょっともうクタクタだったので、もう買い物したりダラダラする時間にしちゃってましたね。
2254280	2256520	あ、そうなんだ。じゃあフィンランドではノーサウナで。
2256760	2260580	そうそうそう。フィンランドではノーサウナ。もうね、これ嫁とも話したんだけど。
2260620	2261520	めっちゃ贅沢だよね。
2263320	2263600	ね。
2264660	2266660	あえてフィンランドでゼロっていう。
2266660	2289340	そう。ただね、空港の周りとか、空港にこう、閉鎖してるホテルを泊まったんですけど、そこのホテルのラウンジの中に結構会議スペースとか、勉強のスペースあったんだけど、そこがサウナ式みたいな、サウナのデザインの勉強部屋とか。
2289340	2290440	へえ。
2290620	2292100	サウナ室みたいな感じで。
2292120	2295220	サウナ室の、そうそうそう。個別で会議室みたいな。
2295700	2296940	それ集中できんのかな。
2297580	2299660	いやいやいや、できないんじゃないですか。
2300360	2301500	まあでも面白くていいですね。
2301700	2310620	そう、なんか、あ、この辺もちょっとサウナの温度感あるんだと思って、今、それもひでたけに画像を送りました。
2311420	2314200	ミーティングスペース2がサウナ風。
2315640	2318500	やっぱちょっと推してるんですね。フィンランド的にも。
2319360	2320020	確かにね。
2320620	2322980	サウナ文化だぜ、みたいな。
2323380	2325840	あ、ほんとだ。すごい、このサウナじゃん、完全に。
2326000	2330840	でしょ。サウナのストーブなし、ミーティングルームみたいな。
2331780	2332680	Bって書いてるじゃん。
2333400	2334540	ミーティングルームBですね。
2334540	2335840	そうそうそう、ミーティングルームB。
2336780	2337460	変なの。
2337840	2338980	変なのだよね、これ。
2339060	2343560	ここにさ、服着て入って、なんか会議するんでしょ。
2343900	2344140	そう。
2345480	2346400	変なの。
2346400	2349340	変なのでしょ。で、使ってください、みたいな。
2349340	2353140	だからみんなで、あの、サウナの位置が違うよね。
2353420	2356900	リラックスもするけど、交流の場として認識してるから、
2357960	2363680	サウナの温かさはないけど、そこ座って横で人の顔見ながら話してね、みたいなことなのかなと思って。
2363860	2368000	そうなのかな。これは、これ観光客向けじゃないですか。
2369380	2370060	わかんないけど。
2371760	2373140	あー、そうなのかな。
2374220	2374940	残念だ。
2375860	2379180	でもホテルとしてはね、めちゃめちゃ良いホテルだったので、
2379340	2385400	はい、なんか、リンクを送って、ぜひフィンランド行った方は泊まっていただきたいなと思うようなとこでしたね。
2385520	2387960	あー、じゃあ、貼っときましょうか、ショーノートに。
2388420	2388540	うん。
2388640	2389680	ここサウナはあるんですか?
2390040	2390600	あ、そうなります。
2391360	2397360	あのね、施設のなんかこう、ジムと一緒に併設みたいな感じで、古めのサウナがありましたね。
2398000	2399420	一応そこにも、そこには入ってるんですか?
2399740	2400600	いや、そこは入ってない。
2401000	2401160	あー。
2401300	2403780	うん。そこ行こうかなと思ったんだけど、ちょっと遠くて。
2403960	2404160	うん。
2404540	2404780	うん。
2405260	2409320	あともう、5日間エストニアにいる間、毎日サウナ入ってるから。
2409340	2411480	だから、くたくた体が。
2413240	2414680	なので、いいかなって。
2415420	2415540	はい。
2415780	2416980	まあ、思うよね、そこは。
2417060	2417760	まあ、そうかもね。
2418060	2418240	うん。
2419360	2420100	でしたでした。
2420800	2428480	はい、そんなところで、エストニアのサウナは、なかなか良きところを楽しんできましたね。
2429220	2430460	いいなー。
2430660	2431440	うーん。
2431840	2437500	これがだからさ、まあ、これだけで1個の旅行じゃないですか。
2438020	2438900	いや、そうですよ。
2438900	2439300	そうですよ。
2439300	2439320	そうですよ。
2439320	2441320	思いきや、これ前編がありましたからね。
2441640	2445500	オリンピック見てからの、これですもんね。
2445640	2447820	そうです、そうです。合計14日間。
2448240	2448400	はい。
2448540	2451420	2回分の海外旅行ですよ。本当に。
2451780	2455760	俺もそう思うわ。そう思うと、結構ギュッと詰めれて良かったなって思う。
2456800	2457300	うーん。
2458600	2462600	体力的にもね、後半がエストニアっていうのがすごく良くて。
2463360	2468420	やっぱり、あのー、まあ、国民性もあって、あのー、
2468420	2470040	スリとかが全然ないので
2470040	2471780	日本に近いって言ってて
2471780	2473540	友人もなんか
2473540	2476900	スタバで仕事してて
2476900	2478660	パソコンマック置いといて
2478660	2480380	トイレ行ってても盗まれないし
2480380	2483780	他の国だと絶対それできないから
2483780	2487460	そこがすごい日本っぽいというか
2487460	2488980	安全だなって思える国
2488980	2490160	なので
2490160	2493880	あまりドキドキせずにいられるって
2493880	2495560	結構安心できるじゃない
2495560	2496280	そうですね
2496280	2498560	結構そこ気づかれしますかね
2498560	2501620	フランス行ってる時にやっぱ子供大丈夫かな
2501620	2503120	嫁大丈夫かなとかさ
2503120	2505220	スリ大丈夫かなっていうので
2505220	2506000	結構神経
2506000	2510460	ビビに張ってるタイミングだったんで
2510460	2512860	その後1週間はもう
2512860	2514260	スパ行ってサウナ行って
2514260	2515220	スパ行ってサウナ行って
2515220	2518200	飯食ってスパ行ってみたいな感じの生活だったんで
2518200	2521140	だいぶリラックスできましたね
2521140	2521640	いいですね
2521640	2524520	スケジュールバッチリですね
2524520	2526260	スケジュールバッチリ狙い通りで
2526260	2530140	もしかしたらエストニアだけ行くっていうのは
2530140	2532840	サウナがっつり入るのは楽しめるかもしれないけど
2532840	2536660	なんかもう少し海外の刺激が欲しい人は
2536660	2538580	やっぱりちょっとフィンランドに行ってみたりとか
2538580	2542280	ちょっとヨーロッパ行ってみるのもありかなとは思うね
2542280	2545220	最後にエストニアでリラックスして帰ってくる
2545220	2546000	そうそうそうそう
2546000	2548800	去年はね
2548800	2550760	エストニア行った後にロンドン行ったから
2550760	2551760	めっちゃ疲れた
2551760	2553280	それ逆でですね
2553280	2554840	めちゃめちゃ疲れたね
2554840	2556240	帰ってきて
2556260	2558980	帰りロンドンのヒースロ空港から
2558980	2560920	ヒースロ空港で
2560920	2562440	帰りジャルだったんですけど
2562440	2566440	ジャルのキャビンアテンドさんが
2566440	2568620	日本人の皆様こちらですって
2568620	2571300	日本語聞こえた時めっちゃ読めた
2571300	2573660	うわーって喜んだもん
2573660	2576400	あー疲れてたーって思って
2576400	2580280	じゃあその反省も生かして今回はフランス先だったんですね
2580280	2583060	うん絶対そっち先にしようと思ったので
2584100	2585940	後半がエストニアで
2586260	2590060	なかなか良い設計だったなと
2590060	2591620	プランニングだったと思っております
2591620	2593500	おすすめでございます
2593500	2597340	いやーおすすめされてもなかなか実践できないわ
2597340	2599000	池田家さんすぐですよ
2599000	2600740	行けますよ
2600740	2601660	行きたいですね
2601660	2602800	行きたいですね
2602800	2606640	でもやっぱり去年行って今年2年連続で行ったから
2606640	2609000	やっぱり子供にとっても
2609000	2611920	海外に行くことのハードルが少し
2611920	2614060	低くなってくれたら嬉しいなと思って
2614060	2616240	フランス編の時に
2616260	2618940	やっぱり子供たちが結構英語で
2618940	2620840	あのー店員さんに声かけたりとか
2620840	2622260	やってましたね
2622260	2624440	うんそういう機会があって
2624440	2627460	エストニアでもちょこちょこそんな機会を設けてたりしてたので
2627460	2628700	なんか
2628700	2631560	うんそこのハードルが下がって
2631560	2633240	なんか物応じせず
2633240	2635580	コミュニケーション取れるようになってくれたらなーとは
2635580	2636940	ちょっと毎年思いながら
2636940	2638320	どっか連れてこうと思いました
2638320	2640760	いやー素晴らしいっすね
2640760	2641760	いやーね
2641760	2644140	罪滅ぼし
2644140	2645560	ふふふ
2645560	2646540	どういうことじゃ
2646540	2647600	ふふふふ
2647600	2649860	意味深なこと言うな
2649860	2652580	何かへの罪滅ぼしですよ僕は
2652580	2653540	本当に
2653540	2657920	その辺の話はちょっとオフラインでやりましょうか
2657920	2658420	はい
2658420	2659160	ありがとうございます
2659160	2661320	そんなとこですかね
2661320	2663480	そんなとこですねすいません長くなりましたから
2663480	2665220	先行編で
2665220	2667660	外極FMとしてもちゃんと
2667660	2668920	はいサウナ行ってきましたと
2668920	2671500	タオル持ってきましたと
2671500	2673820	誰かに配ったんですか
2673820	2674760	えーっとですね
2675560	2676880	けんちゃんぐらいですね
2676880	2677980	まあそうですよね
2677980	2679480	タオル
2679480	2682080	余ってるんですよね
2682080	2685700	Twitterに連絡くれた方にはプレゼントしたいですね
2685700	2686880	そうですね
2686880	2689120	DMくれたらちょっと感想とね
2689120	2690560	一緒に
2690560	2692760	いやー楽しかったです
2692760	2696500	ちょっと早めに今年ももう一回京都に行って
2696500	2697320	はい
2697320	2699040	えーちょっと白山湯と
2699040	2702000	五香湯などで一回身を清めたいと思っております
2702000	2703420	疲れを癒してください
2703420	2704360	癒したいですね
2704360	2704940	はい
2704940	2705400	はい
2705400	2706000	また行きましょう
2706000	2706780	はい行きましょう
2706780	2708460	じゃあお疲れ様です
2708460	2709300	お疲れ様でした
