start	end	text
400	3180	こんにちは、外極FMです。今日もよろしくお願いします。
4660	5540	よろしくお願いします。
6900	11960	いやー、前回フランスの話をタラタラ、長々と話させていただきました。
12280	12500	はい。
13780	15920	今日はエストニア編です。
18580	21020	もうそんな感じでどんどん話していっちゃおうかなと。
22080	22480	お願いします。
23420	29020	はい、楽しかったので。でも今回はちょっとサウナ中心の話をしていこうかなと思ってます。
29020	30820	お、外極FMらしく。
31640	32980	らしくです。はい。
33320	43500	あの、前回は本当にバスケの話とか陸上の話などオリンピックにかなり降っていたので、あんまりね、サウナに入る機会がなかったので。
44980	47740	エストニアに来てからかな、のんびりし始めたのは。
48040	48340	うんうん。
49100	58140	はい。なんですが、フランスから、フランスのシャルルドゴール空港から、やっぱりフィンランド経由ですね。
58240	59000	フィンランド。
59020	70840	フィンランドのヘルシンキ空港を通って、ヘルシンキからはもう30分ですね、トランジットして、エストニアのタリン空港に行くようなスケジュールでしたね。去年と一緒です。
71320	74900	パリからフィンランドまではどれくらいなんですか?
75660	76700	フィンランドまで2時間くらい。
77020	79040	あ、じゃあ2時間と30分か。
79400	83540	はい。結構あっという間だったね。フィンランドで乗り換え1時間くらい。
83540	83580	はい。
83700	88780	あの、去年ちょっとミスって、日本からエストニア行くときと。
89020	96800	エストニア行くときのトランジット期間が短すぎて、すごい急いだんですよ。本当に端から端までダッシュしたみたいな。
96800	97880	あー、なんか言ってましたね。
98280	109900	感じのことをやってたんですが、今回はもうそれが分かってたので、もうとにかく飛行機から早く降りる。目的地に向かうみたいな感じで、ピシピシと動いてたら、あっという間に行けました。
110320	113600	パリから行ったときも、やっぱ端から端まで行く感じ。
113600	118320	端から端。エストニアのタリン空港に行く飛行機が端なんだろうね。
119020	126600	今回も一緒だった。フィンランドの方の端の方の空港だったので、はい、そこまで走らされましたね。
127700	128680	やっぱり走るんですか?
128680	134920	あ、いやいやいや、行かされましたね、ですね。そっちまで。私今回はね、もうちゃんと急いで行ったので。
135760	143600	はい。今回やっといてよかったなと思ったのは、やっぱあの、トランジットするときにスーツケースの全部にエアタク仕込んどいたんですよ。
143940	144340	おー。
144660	148780	はい。なのでちゃんと、あ、フィンランドで降りてるなとか、自分の。
149020	154120	同じ飛行機にいるなみたいなことが分かったので、何の心配もなく。
154620	155260	安心ですね。
155480	165560	安心ですね。今回あの、友人が、まあちょっとまた別の時間に、軸にはなりますが、エストニアから日本に帰ってくるとき、あの、スーツケースが戻ってこない事件がありまして。
165680	166320	あ、そうなんですね。
166520	173640	はい。1週間帰ってきても来ないとか。はい。その人もエアタク仕込んでて、フィンランドで乗り込めなかったそいつだけみたいな。
175720	179000	エストニア経由、フィンランド経由で帰ったときにフィンランド。
179020	184540	フィンランドに置いてかれて、あの、荷物が帰ってこなかったみたいなことをしてましたね。
184960	186820	まあ分かってもどうしようもないっていう。
186860	192900	そうだね。ただまあ、あったら、あ、ここにいるんだなということは分かるので、まだ気が楽かな。
193500	197040	確かに分かってなかったら、ずっとあの、出口のところで待ち続けます。
197100	199280	あ、そうそうそうそうそう。そう。
199560	201740	分かってたら、まあどうせ来ねえなっていう。
202060	206860	うん。羽田まで着いてタグ見て、あれ?フィンランドから動いてねえとか。
206860	207280	あはは。
209020	211940	フィンランドからなったら、もう、はい、話が早いので。
212040	212560	まあそうですね。
213060	214700	はい、そこはおすすめでしたね。
214960	217980	僕も最近結構旅行行くときは、エアタグ入れてますね。
218220	218760	あ、いいね。
218860	225760	うん。その、預け荷物じゃなかったとしても、まあ旅行中もね、なんか取られたりとか、あの、線もあるから、うん、入れてますね。
225900	227280	私も財布にも入れてます。
227500	229940	おう。財布に入れるにはちょっとでかくないですか、あれ。
230300	231760	あ、エアタグじゃなくてね。
232080	233180	あ、あのカード型のやつ。
233220	238740	そうそうそうそうそう。それのね、あ、ごめん、名前がちょっと違うな。あの、アンカーのやつの方入れてる。
239020	239120	うん。
239600	245440	あれだと結構ちっちゃいやつがあって、コインぐらいのやつがあるので、500円玉ぐらいの、それを入れてますね。
247060	247780	なかなか良い。
248160	253020	あと娘2人いるので、娘2人のリュックにも仕込んでる。荷物みたいなもんなんで。
253580	260240	はい。どっか行かれても大丈夫なように、はい、2人ともいるなというような感じで。
260520	264920	スーツケース2つ、私、子供2つで、5個分のエアタグを見てるような感じですね。
265800	268800	はい。で、エストニア着いて。
269020	274680	はい。えっと、エストニアの、えっと、タリン空港からタリンの市内まで30分ぐらいなんですよ、タクシーで。
275220	281500	で、パーッと行くんですけど、昨日、お金の振り返りして思いましたけど、やっぱタクシーも安かったですね、エストニアは。
281640	282280	あ、そうなんですね。
282500	291820	うーん。そこまでも800円とか1000円ぐらいで行けましたので、はい。しかもそれを4人とかで乗ってたらだいぶ安くなるよね、終わったら。
292400	292560	うん。
293680	298560	で、今回泊まったホテルが最初の3日間がタリン。
299020	306640	タリンって、あの、えっと、ちょ、ほんとにど真ん中に、あの、旧市街と呼ばれる世界遺産の街があるんですよ。
307280	312320	レンガ作りの、あの、石畳があってレンガ作りの家がたくさんあるような。
312580	312900	うんうん。
313280	319000	その街自体が世界遺産になってるんですけど、そこの中の一角をエアビーで借りたんですよ。
319320	320280	おー、なんか良さそうですね。
320540	321200	良さそうでしょ。
321360	321480	うん。
321800	326920	そう、あの、ほんとに、あの、昔なのでちょっと使いづらかったんですけど。
327920	328280	うん?
328800	329000	あ、いいですね。
329020	330600	家の設備がってことね。
330760	337440	あの、しかも旧市街なので、石畳をすっつけつってガラガラガラって行くので、タクシーもここまでしか入れませんとかあるから。
337600	337940	あー。
338400	347160	ちょっと若干の大変さはあったんだけど、あったけど世界遺産のど真ん中に泊まるっていうのはなかなかできない体験だったんで。
347300	347440	うん。
347700	351000	ちょっと今回エアビー取ってみたいなと思ってやったんですよ。
351860	356600	で、そこを選んだ条件としてもいろんなとこに行きやすいっていうのもそうだし、
357080	359000	まあ、ホテルじゃなく昔のエステリアとか、
359020	361720	本当にあの、家に泊まってみたいなっていうのもあったので、
362440	362620	はい。
363320	365680	えっと、石づく、石、石づくり?違うな。
365860	372400	えっと、コンクリートみたいなところの石の階段を登っていくんですが、そこすっつけつ頑張って持ってって。
373340	374780	それも大変なんですけどね。
375300	375520	はい。
376060	379540	でも、家としてはほんとに広くて、3LDKぐらい。
379840	380020	うん。
380300	381760	広くて、はい。
382060	383640	あの、ソファーもでかい。
383920	385520	えー、比較的清潔。
386320	387540	で、そこにサウナがあるんですよ。
387800	388800	あ、そこにもちゃんと住んでる。
388800	389520	ちゃんとついてるんですね。
389700	391140	はい。それ狙いでもあって。
391620	392220	さすが。
393460	395740	今回まず一発目のサウナがそこでしたね。
396180	406940	エストニアについて、まあまず、いろんなサウナもあるけど、その、昔ながらついてるようなお家についてるサウナを入ってみたいと思って、そこを借りたんですよ。
407040	409920	えー、そのサウナも結構だから、昔からあるってことですか?
409920	413340	比較的なんか古そうだなと思った。ボロッとはしてた。
414400	415680	まあ、そこもいいじゃないですか。
415720	416120	うん、いいです。
416280	418780	そう、で、3人ぐらい入れるような。
418780	429220	感じ。上に2人、下に1人みたいな。足置くとこ1人みたいな感じの設備なんですけど、えっと、えー、ストーブは結構老舗のストーブ。
429820	429980	はい。
430460	431420	いいろっていう。はい。
431600	439900	古めのストーブと、あと驚いたのが、あの、ストーブって、あ、ごめんなさい。椅子が2段をちょっと想像していただきたいんですね。
440560	446820	2段の椅子。で、1段目が収納式になってて、よくわかんないでしょ。
447060	448080	座面を開けて。
448780	450760	あ、そう、座面を上に上げる感じ。
450900	451040	うん。
451600	459860	で、あの、その座面を上げると、2段目の椅子と下の間に、えー、洗濯機置いたんですよ。
460700	460980	え?
461240	462080	意味わかんないでしょ。
464080	469060	椅子の下に洗濯機置いてるっていう、めちゃめちゃ危ない作りになってて。
469640	473280	えー、え、サウナしてないときはそこで洗濯するってことですか?
473440	474340	そうなんですよ。
474600	475340	すごいな、それ。
475420	476560	意味わかんなくて。
477420	477660	はい。
477900	478740	壊れないんですかね。
478780	479880	いや、そうなの。
480200	482960	え、でも、サウナのとき、いいの?と思って。
483200	483380	うん。
483780	488740	サウナしてるとき、ガンガン洗濯機温めてるよと思って。
488920	494900	ねえ、熱もすごいし、湿度もすごいし、機械にとっては結構劣悪な環境だと。
495140	495660	いいんだって。
496080	497680	いいんだってというか。
497840	499100	よくあることなんですかね。
499320	503840	いや、これ、エストニアに住んでる方にも聞いたんだけど、いや、珍しいねって言ってた。
503920	504460	へー。
504700	504980	うん。
505480	508400	すごい、なんか、収納されてていいねみたいに言ってたけど。
508780	509340	いいのかな。
509500	513900	いいのかと思って、ちょっと、うん、心配になるような。
514380	517040	だってそんなさ、日本の家みたいにちっちゃくないんでしょ。
518300	518880	だってどういうこと?
519120	526140	その、日本の、さ、まあ日本の家みたいにって言ったらあれですけど、その、頑張って収納しないといけないほどちっちゃい家ではないんですよね。
526160	527380	うん、置くとこあるやんと思ってる。
528280	529460	全然いっぱいあるよ。
529760	531300	今、あの、写真を送りました。
532240	538000	いや、全然他に置けるのに、なぜわざわざここに置くっていうような。
538260	538620	ははは。
538780	539260	ほんとだ。
539620	539880	はい。
540360	541540	洗濯機置いてある。
541760	542200	でしょ。
542340	543340	サウナの中に。
543820	544860	びっくりして。
544960	549040	すごい、これなんだかわかんないですね。でも、洗濯機があるわけないと思うから。
549600	549860	うん。
550520	551860	いや、だから、え?って思いながら。
552080	553600	何かなって思いますよね、これなんか。
553600	553900	そう。
554300	557280	で、一応調べてったら、洗濯機だってわかって使えたよ。
558420	560460	いや、せっかくだから使ってみようと思って。
560820	563760	この椅子のとこ取り除くと、洗濯機が使えるようになるんですね。
564140	566140	そうです、そうです。変な作りでしょ。
566320	566760	面白。
567220	567540	そう。
568780	570940	みんな珍しそうに見てたね。
571400	575640	でもやっぱ、あれなんですね。エストニアのサウナってちょっとガラス張りなんですか?
576140	582100	あ、比較的多いですね。うん、ガラス張りで結構外見えるような感じのが多い。
582780	583180	おしゃれ。
583500	587960	うん、なんか木で割れてる感じではなく。これ結構おしゃれよね。
588280	588380	ね。
588920	591400	うん、なかなか良さげだったよ、ここは。
591500	591720	うん。
592140	598760	そう。で、ここのサウナ一発目、はい、あの、我々、けんちゃんと一緒に外記憶FMのタオルを。
598780	602920	使えて、はい、あの、入らせていただきました。はい。
604020	613220	まあ、水風呂はね、まあ、当然、風呂って風呂がないので、シャワーで入るような感じだったんですけど、もう一発で、はい、もう気持ちよくなりましたね。
613380	613680	だいぶ。
614480	620260	はい、もともとのね、あの、オリンピックの疲れもあったんですけど、なかなか良かったです。
620580	625440	ちょっと難点といえば、昔ながらすぎるので、匂いがちょっとね。
625900	626660	ああ、そうなんだ。
626660	628740	いい木の匂いというよりは、ちょっとまあ。
628780	631100	ああ、これはだいぶ年季あるなっていう。
631980	638340	はい、ちょっとだけ、カビ臭いとは言わないですけど、ちょっと木の使い古した匂いと言いますか。
638980	639220	うん。
639740	647360	なんか、木元々に匂いで楽しむとかではないから、やっぱ経年劣化していくとこういう匂いになっちゃうのかなとか、ちょっと。
647820	648180	うんうん。
648300	648500	うん。
648920	650820	それか洗濯機のせいかわかんないですけど。
651240	651780	確かに。
652400	654480	洗濯機もまあまあ匂い出しますからね。
654480	657720	いや、そうそうそうそう。何が答えか俺にはわかんないんだけど。
658060	658440	それって。
658780	661880	そして、なんかアロマの匂いとかつけてもあんまり。
662280	665520	そうそうそう。それをね、すればまだ変わったんだなって思う。
665680	665860	うん。
666200	667760	あの、アロマとか持ってってなくて。
667860	668680	ああ、そうかそうか。
668940	671420	そう、普通にさらっと帰っちゃった場所だったので。
671500	671620	うん。
672100	672300	うん。
673420	683320	で、なかなかね、ちょっと面白いなと思って行ったんですけど、あの、そのサウナのドアの作りをちょっともう少し説明したいんですけど、
683320	686700	えっと、これちょこちょこあるよって言われたんだけど、
687100	688680	サウナのドアと、
688780	692560	隣にあるシャワー室のドアが併用されてて。
693180	693320	ああ。
694400	694640	はい。
695780	702180	なので、シャワーに入るときはシャワー側のドアになり、サウナ室は開いてる状態。
702420	708000	ああ、そういうことか。サウナ室開けると、こっち側のドアが閉まることになるんだ、シャワーブース側が。
708160	711020	そう。で、これもちょこちょこあるらしくて。
711160	715820	そうなんだ。なんか、エストニア結構あれなんですね。こう、こういうの好きなんですね、じゃあ。
716860	717960	なんか、変じゃない?
718780	721640	2役させるのが好きなんですかね。
722360	723420	え、なんか他にあったっけ?
723720	727260	いや、このサウナ室と洗濯ルーム。
728240	735420	いやー、でも、友人のお家、マンションにお邪魔したけど、そこは比較的新しめで、まあサウナはちょっと古かったけど、
735660	743160	それでもサウナ室はサウナ室のドアあったんですけど、なんか若干あるみたいね、こういうデザインの。
743260	744340	うん、面白いですね。
744620	744900	はい。
745540	747500	だから、2人でけんちゃんと入ったので、
748060	748180	うん。
748180	751220	2人が水入ってるときは、サウナ室だだっぴらきなのよね。
751720	752620	あ、そういうことか。
753680	754620	しょうがないよね、それは。
755340	760300	そうですね、これドア閉めないと水が外に出ちゃいますもんね、バシャーと。
760540	760700	うん。
761300	761540	はい。
762340	767880	っていう、なかなか難しい、ちょっと難易度の高いサウナに入ってきましたね。
769680	775200	なんか、2役させようとうまくやってるように見せて、あんま上手くないっすね。
775420	776300	全然上手くない。
776900	777100	うん。
778180	785840	なんか、ここもうちょっと部屋広くできたんじゃねとか、やっぱり思うよね。
786680	786960	うん。
787300	789140	なんか、いろいろ思うところは正直あった。
790080	790300	うん。
791240	791500	はい。
791640	792660	まあまあ、面白いですね、でも。
792660	792960	うん。
793100	797440	一発目のサウナとしては、なかなかエキサイティングで楽しかったんじゃないかなと。
797940	800660	もう、なんか、違う国のサウナ来たな、みたいな。
801200	801320	はい。
801820	808040	これ来ちゃったから、その後、あの、エラムスっていう、あの、去年も行ったんですけど。
808180	810540	大きなスパも、あの、次の日行くんですけど。
811320	816700	その次の日行く前に、超地元のロシアサウナにもともと行く予定だったんですよ。
816940	817120	うん。
817580	818080	けんちゃんと。
818180	823220	なんか、今回あれですよね、そういう地元人が行くようなサウナ行くって言ってましたね。
823220	830080	そう。テーマとしてそれがあったんだけど、けんちゃんがそれ入っちゃって、なんか、いいサウナ入りてえな、みたいな。
831560	838140	今回、その、2つのドアと、ちょっと臭めのサウナ、プラス、洗濯機。
838180	850980	のサウナに入っちゃったから、なんか、ちゃんとしたとこ入りたいって言ってたので、じゃあ、もう、エラムス行っちゃおうぜってなってしまい、あの、ロシアの、その、カルマスパっていうとこなんですけど、カルマサウナか。
851600	853620	ロシアサウナは行くの断念しちゃいました。
853960	856940	そうなんですね。あれ、今回のテーマは。
857120	861780	そう、テーマね、もう、いきなりぶった切って、普通にいいサウナ行こうぜになりました。
863100	865820	まあ、まあ、まあ、それはそれでいいかなと思って。
865820	867960	で、そこの後。
868180	887140	あの、はい、私たちの大好きなエラムススパに行きまして、えっと、けんちゃんは初めてそこ行き、去年は私、妻を連れてくこともできなかったので、もう、この1年でだいぶ、妻もサウナにめちゃめちゃ入る子になりましたので、はい、あの、エラムスを堪能してましたね。
887140	897840	ほとんど、僕が子供のこと見て、はい、私の妻とけんちゃんが一緒にローリー受けたり、アフグス受けたりとか、楽しいところいっぱい行ってて。
897840	903100	で、僕が子供2人を見てるみたいな感じのサウナになりましたね。
904240	919680	で、エラムススパって、あの、サウナがほんとに20数個、なんか、今、改装しててまた増やすみたいな感じになってて、もう、ほんとにサウナが多いところでして、タリンから、まあ、車で20分ぐらいのところにある大きいスパ施設。
919680	927680	で、TTNEがやってる表彰、サウナ37みたいな、世界中のワールドサウナ。
927840	931380	サウナアワードみたいなのをやってて、そこに選ばれた一つですね。
931880	936400	えー、そんなのやってるんですね。あれ?サウナシュランをやってるのもTTNEでしたっけ?
936440	939900	あ、そうです。サウナシュランは確かに日本、ん?日本か、どうなんだろう。
940440	942560	多分日本だけな気がしますね。うん。
943200	945220	それのワールドワイド版もやってるんですね。
945300	949880	そうそうそう。それの一個でエラムススパが選ばれてたりして、うん。
950380	955040	まあ、そこのなんかロビー活動を整うのを社長がしてた感じはあるのかなとは思うんですけど。
955320	956060	ロビー活動?
956220	957800	ん?いや、なんか、いや、選ぶ。
957840	960300	エストニアのここいいですよって紹介したりして。
960300	961640	あー、そのTTNEに?
961880	962580	そうそうそうそう。
963000	966740	なんか、日本の会社同士でやってるんですね。
967640	969260	なんかちょっとそこはありますけど。
970100	975340	まあまあでも、あのエラムススパ入った入り口のとこに堂々とそれのなんか、あの、症状とか。
975720	975860	うん。
976320	980400	はい、それ専用で作られたサウナハットとか置かれてたりして。
980500	981260	あ、そうなんですね。
981380	986380	はい、なんでワールドでそういうので選ばれましたみたいな感じで誇らしくは置いてたね。
986380	986740	なるほど。
987100	987820	なんかじゃあ日本で。
987840	991260	勝手にやってるみたいな感じではなくて、一応ちゃんと向こうも。
991340	994560	あ、ではなくそこの受ける側も喜んでくれてるんじゃないかと。
994820	995100	なるほど。
995660	997380	はい、なんでそこは良かったなと思ってます。
997540	997620	はい。
998660	1012160	で、そこ入った時にやっぱスパもあるので子供たちもたくさん遊べますし、サウナも暑いやつから結構落ち着いたサウナまでと、今回ちょっと前回行ってないところいっぱい行ってきたいなと思って。
1012160	1016760	で、一個ちょっと面白かったのが新しいサウナだったんですけど。
1017560	1017820	えーと。
1017840	1019480	これ、何人って言ってたかな。
1019740	1024940	最大50人ぐらい入れるサウナってめちゃめちゃ広いんですよ。
1026040	1034740	めちゃめちゃ広くて、で、中にモニターがついてて、そのど真ん中にサウナのストーブがあるような。
1035260	1039100	で、真っ暗になって椅子の座面が緑に光ると。
1039500	1041140	周りは赤に光るみたいなもう。
1041600	1042760	もうクラブみたいな。
1043040	1043880	あ、そうそうそうそう。
1044780	1047100	っていうめちゃめちゃでかいサウナがありました。
1047100	1047800	うんうん。
1047840	1051000	そういう、創価健康センターの場合みたいな感じだなと思って。
1051280	1053120	あそこも相当でかいですもんね。
1053260	1056060	でかい。でかい。それが両面にあるみたいな。
1056080	1056800	へー。
1057100	1058980	感じですね。はい。
1059920	1061220	そんな人いっぱいいるんですか?
1061540	1063380	いや、ここね、誰もいなかった。
1065600	1066440	大丈夫かそれ。
