start	end	text
1067720	1075760	ここは誰もいなくて、温度もそこそこだったから、子供たち2人がずっとそこの、あのストーブの周りを歩き回ってた。
1076240	1077320	でかすぎて。
1077320	1078600	でかすぎて。ぬるいってことですか?
1078600	1083360	そうそうそう。相当な出力必要に乗ってくる。出力とか火力が必要になるから。
1083820	1084320	うん。
1084540	1096440	あの、ほんとに、僕が知ってる限り最大級のサウナなんだと思ったけど、そんな別にこう、熱くもなく人もいなくて、うーんって思いながら、はい。
1096440	1098440	何かイベントとかやるんですかね。
1098700	1100460	あー、そういうのはあるかもね。
1100460	1100960	ね。
1101120	1101620	うん。
1102280	1106280	でもイベントはもう決まってるんですよ、大体。
1106280	1116740	で、平日は1時間ごとに、ここでアウフグースやりますとか、ここで、あのー、なんかスパイシーなイベントやりますみたいなのがこう、ついてるんですよ。
1117040	1117540	うーん。
1117820	1118060	はい。
1118720	1120820	でも1時間ごとってすごいですね。1時間ごとに。
1121260	1124700	いろんなサウナ施設があるから、それぞれのところに来るんですよ。
1125300	1130780	あのー、そう。で、その、アウフグースとかやる人たちを、日本だと熱波師って言うじゃないですか。
1130860	1131280	言いますね。
1131600	1133360	はい。こっちだとサウナマスターって言うんですよ。
1133520	1134240	おー、かっこいい。
1134240	1135040	かっこいいよね。
1136280	1150360	そう。サウナマスターが、あのー、エストニア語と英語で、今からやる、あのー、アロマについての説明をしたり、ビヒタの使い方を教えてくれたりとか、で、わっさわっさみんなで、わっさわっさわっさわっさやるんですね。
1150560	1150720	うん。
1151100	1151240	はい。
1151840	1154720	うん。なかなかよかったですね、これも。
1154720	1155040	うん。
1156040	1166180	で、あのー、ここ、サウナいろいろ入れるんですけど、そうですね、アウフグースのサウナマスターにすごい目をかけてもらったうちの妻が、もう。
1166280	1174880	ガンガンにバサバサされて、ビヒタもなんか人一倍サウナマスターにしてもらったらしくて、最高だったって言ってた。
1177320	1186460	最近はね、なんか日本人もちょこちょこやっぱりそういうののおかげで来てるらしくて、うん、ジャパニーズが多くなってきたみたいな話をされてましたね。
1186640	1188940	あー、やっぱサウナ入りに行くんですね。
1189100	1190140	行くんだと思います。
1190380	1191340	うん。サウナ旅。
1191340	1191440	うん。
1192200	1195160	僕がいたときはちょっと一人も日本人見なかったけど。
1195960	1196100	でも。
1196280	1198840	まあまあ、そうやって来る方が増えてきてるから。
1199680	1199900	うん。
1200180	1203260	いや、ここは人だけ連れてきたいなと、本当に。
1203300	1204300	いやー、行きたい。
1204540	1205500	思いましたね。
1206060	1206080	うん。
1206080	1208880	あー、たくさんのサウナあって、もう困っちゃうよ。
1209240	1210200	ははは。
1210260	1211060	確かにね。
1211580	1211980	うん。
1212740	1220080	5、60人入れるサウナに2人でポツンといて、ここじゃねえなみたいな感じで、楽しいんじゃないかなと。
1220080	1221180	ははは。
1222440	1226080	で、あの、ここの名物というか、エストニアの楽しみの一つ。
1226280	1235340	そして、あのー、黒パンといってパンを結構焦がしたようなやつがあるんですけど、それとかをサワークリームとか塗って食べるんだよね。
1235640	1239400	えー、黒パンって昔、給食で出たような気がする。
1239560	1242240	いや、俺それ知らないんだよね。なんかそれちょこちょこ言う人いるね。
1242300	1242880	あー、そうなんだ。
1243100	1243900	うん、俺知らん。
1243960	1245920	黒パンってすっごい久しぶりに聞いた、今。
1246260	1248440	あ、日本で食うんだ。
1249060	1250200	俺食ったことない。
1250200	1255040	多分、なんか給食で黒パンってあった気がするな。小学校の時。
1255200	1256000	へー。
1256280	1258460	全然知らないな、それ。
1259580	1261500	ライムギパン、結構固めのやつね。
1261780	1272360	当時はさ、普通の、なんか、揚げパンとかコッペパンとかと並んで黒パンって普通に、このメニューに書いてあるから、一般的なパンなんだなって当時は思ってたんですよ。
1272440	1273120	思うよね。
1273300	1278220	でも、小学校卒業してから一度も出会ってないっていうのに今は気づいた。
1280720	1281400	そうだね。
1282400	1286140	今、言われて出てくるのが久々みたいな感じ。
1286280	1286640	そういうやつなんだ。
1287000	1287160	うん。
1287420	1288960	ははははは。
1289580	1299840	でも、その、黒パンが結構なんか重要な、重要な、なんか長い歴史の中で、あの、なんだっけ、食卓の主役みたいな、エストニアでは。
1300180	1300880	へー。
1300940	1302580	だったらしくて、黒パンが。
1303040	1303260	うん。
1304380	1306400	だから、あの、スーパーでもよく見ましたね。
1306720	1307340	うーん。
1308120	1315480	で、あの、これは友人から聞いたんだけど、黒パンを床に落としたらキスしないといけないって言われるくらい大切にされてるんだよって言われて、
1315480	1316520	どういうことやって思った?
1316960	1317860	キス、床に?
1318280	1318560	そう。
1319740	1321940	いや、床なのかな、パンなのかな。
1323280	1324900	拾ってそのパンにキスすると。
1324920	1325740	わからんけど。
1326600	1327880	まあ、とにかく大事なんですね。
1328180	1328960	大事らしいよ。
1329260	1329440	そう。
1330600	1332600	で、ほとんどやっぱ食ったことなくて、俺は。
1333100	1333280	うん。
1333620	1334600	その黒パンを。
1335380	1342740	で、サウナ上がりに、あの、それとさっきのサワークリームとかなんかチーズバターついてるようなやつと一緒に食べる感じなんですけど、
1343220	1344240	まあ、おいしいですね。
1344240	1345120	なかなか。
1345480	1349780	あとフライドポテトいっぱい食べるみたいな感じの試しでしたね。
1349940	1355100	あと、あの、エラムススパとかエストニアやフィンランドのサウナはやっぱりビール飲んでいいので。
1355620	1355940	中で?
1356320	1365800	サウナの中というよりはサウナ終わった後に普通に大人の車高場として、はい、ビール飲んでいいので、そのスパとかサウナを横目に外でビール飲むと。
1366540	1366900	いいですね。
1367660	1369840	私ビール飲むともう一気に終わるからさ。
1370100	1370240	うん。
1371060	1374040	中盤後半ぐらいに飲んでもずっとあとダラダラしてたね。
1374240	1375240	ふふふ。
1375480	1378880	それはビール飲んだ後にももう一回サウナに入ったりもするんですか?
1379040	1379760	もちろんもちろん。
1379880	1380240	まあ、そうか。
1380560	1382100	そうそうそう。みんなそれができる。
1383260	1384400	いやー。
1384440	1388100	まあ、今回も正直去年見たところをもう一回見るみたいな感じ。
1388560	1397080	で、比較的去年見たときよりはなんか急排気どうなってるのかなとか、座面の高さどのぐらいだとすごい厚さあるのかなとか、
1397900	1405460	ドアのやつのヒンジってどんなの使ってんのかなとか、そういうちょっと今までの仕事で学んだような。
1405460	1407500	そんなことをよく振り返る場になりましたね。
1407800	1409500	業者やん。まあ、業者か。
1411320	1424480	で、そこのエラムススパ楽しんで、次の日かな、今度はもうちょっと北にあるアクアスパという別のスパにも行ってきました。
1424800	1426320	そこは初めて行くとこですか?
1426460	1427240	初めて行くとこです。
1427620	1427720	はい。
1428620	1432860	で、そっちはですね、結構なんと言いましょう。
1433460	1435420	あの、プールの方がメイン。
1435460	1438800	というか、あの、ハワイアンズで行くと。
1438940	1440520	ハワイアンズって行ったことないですよね。
1440640	1441420	行ったことないですね。
1441540	1442180	行ったことないですよね。
1442860	1444700	ウォータースライダーいっぱいある系ですね。
1444960	1445100	うん。
1446040	1448020	だからプールめちゃめちゃ楽しいです。
1448440	1453720	で、プラスサウナもあるよみたいな感じのところですね。
1453940	1454720	アクアパーク。
1456220	1458320	そこも結構サウナがあったんですけど、
1459060	1463060	いやー、あの、なんか、まあまあサウナ自体も全部よかったんだけど、
1463060	1463620	だから、
1463620	1464020	だから、
1464220	1465440	外気浴すると、
1465460	1478900	好きに、あの、白樺とか、松の木とか、それを見ながら、それと空しかないみたいな感じのとこで外気浴できるので、そこがやっぱりよかったかな。
1479480	1480220	あー、いいですね。
1480640	1481300	うーん。
1481580	1484680	結構もう自然な感じなんですか、外は。
1484860	1485660	あ、そうそうそうそう。
1486100	1487740	えー、山奥みたいな感じ?
1487740	1493240	あ、いやいやいや、いや、普通の、都内、都心とかではない、一応市ではあるんだけど、
1493800	1495440	ただ、やっぱ施設できて、
1495460	1501800	ちょっと広めの外気浴スペース取ったら、なんか、基本そんな感じになってるよね。
1502180	1503920	あー、じゃあちゃんと庭みたいなの作って。
1503920	1511920	そう、広くて、なんか、やっぱり日本のそういう施設って、あの、お風呂の隙間にあったりとか、
1512340	1515420	ちょっとだけ狭いけど外見えるみたいな感じになってるけども、
1515940	1518800	外気浴のためだけに結構広い庭ちゃんと取ってるというか。
1518800	1519560	あー、いいですね。
1520040	1520640	うーん。
1520980	1521780	今回ね、あの、
1522300	1524680	さっきのエラムススパの外気浴スペースが今、
1524680	1525860	ちょっと工事中で、
1526540	1528700	そこはちょっと完全には楽しめなかったんですけど、
1529060	1530980	去年俺そこ天国だと思ったもん。
1532020	1535400	あー、なんか、去年エピソードでも話してたかな?
1535620	1535780	うん。
1535980	1537240	そう、天国だった。
1537280	1540880	ほんとに、あ、ここはなんか死んだら来る場所なのかなみたいな。
1542460	1545040	良い行いした人だけが来れそうな、
1545100	1548620	あの、木々と鳥の声と、
1549340	1550620	えー、温かい日差し、
1551060	1551560	芝生、
1552260	1552900	えーっと、
1552900	1554520	リクライニングの椅子みたいな、
1554520	1557340	そして、広々としてて全然人いなくて。
1557340	1558340	あー、いいっすねー。
1559120	1559700	そう。
1560040	1561600	で、今回のアクアスパっていうのは、
1561600	1565080	まあ、そこよりはちょっとスペース自体は狭いんだけど、
1565980	1568920	やっぱり上の、上にある目の前の松の木とか、
1569440	1572200	白樺見ながらちょっと外気浴できるっていうのは、
1572200	1573840	なかなか良かったですねー。
1574000	1574580	いいっすねー。
1574580	1578060	確かに外気浴スペース、日本だとなんかね、
1578060	1582200	やっぱ一応屋根がないから空は見えるけど、
1582900	1584200	囲われてるとかね、
1584520	1585360	そういうのばっかりですよね。
1585860	1587360	ある程度囲われてても、
1587500	1590700	少しそこに広さがあって人が少なかったら、
1591220	1592940	なんか上がこう広く見えるというか、
1593840	1595740	あー、なんかそういうのが、
1596560	1598440	ちょっとこういう田舎だったり、
1598500	1599860	こっち多いのかなと思ったね。
1601580	1603480	で、あのー、ずっと気温の話に、
1603540	1605140	ちょっと天気の話になるんですけど、
1605720	1607920	行ってる間20度前後だったんですよね。
1608140	1609300	おー、涼しいですね。
1609420	1610900	涼しいっす、涼しいっす。
1611280	1611460	はい。
1611460	1613200	ちょいちょいあったかかったとしても、
1613400	1614320	ほんとに25度から、
1614520	1616600	18度ぐらいみたいな感じなので、
1616720	1618480	まあまあ半袖で行けるけど、
1618560	1622360	夕方ぐらいは長袖になるかなみたいな感じだったので、
1622520	1623840	めちゃめちゃ気候は良いと。
1624740	1626340	なのでエストニアの方たちは、
1626600	1629200	あんまりこういうスパに来ないらしいんですよ、
1629240	1629700	この時期。
1630760	1630940	うん。
1631340	1631560	はい。
1631940	1632100	え?
1632160	1632200	え?
1632200	1632220	え?
1632220	1632240	え?
1632240	1632260	え?
1632260	1632360	え?
1632360	1632460	え?
1632460	1632480	え?
1632480	1632540	え?
1632540	1632720	え?
1632720	1632760	え?
1632760	1632780	え?
1632780	1632800	え?
1632800	1632820	え?
1632820	1632840	え?
1632840	1632860	え?
1632860	1632880	え?
1632880	1632980	え?
1632980	1633000	え?
1633000	1633060	え?
1633060	1633080	え?
1633080	1633380	え?
1633380	1633400	え?
1633400	1633460	え?
1633460	1633740	え?
1633740	1633780	え?
1633780	1633800	え?
1633800	1633820	え?
1633820	1633840	え?
1633840	1633860	え?
1633860	1644720	あ、そうなんだ。
1644940	1645120	そう。
1645600	1647780	だからプールとかサウナのある理由が、
1647940	1649200	秋冬用らしくて。
1649380	1650080	へー。
1650760	1652940	僕らはもうこの時期だと思って行ってるじゃん。
1653880	1655840	暑い時だからもうプール行きたい。
1656120	1659100	もちろんそれで子供たちプール入ってくるんだけど、
1659860	1661780	メインは秋冬ですよって言われて、
1662420	1663840	へーと思ってびっくりした。
1663860	1664120	うん。
1666020	1668860	でも確かにプールで子供たちが遊べて、
1669640	1672960	のんびり体を温めるという点では、
1673740	1676400	確かに冬とかも全然いいなと思いましたね。
1677260	1679460	まあ室内プールならね、全然いいっすよね。
1680640	1684840	やっぱ雪でね、覆われてしまったら遊ぶところがないからさ。
1685000	1685740	あーそっか。
1686100	1686360	うん。
1687680	1692540	じゃあ夏の間にアウトドア、外に遊びに行くって感じなんですかね?
1693540	1693840	いいですね。
1693840	1698460	今は外でしっかりあの太陽浴びるみたいな感じって言ってたね。
1698500	1699760	貴重な時間だっつって。
1700080	1700300	なるほど。
1701360	1701900	面白いよね。
1702060	1705860	そこのなんか、あの国によってそこのもの、
1706080	1708820	プールとかサウナの位置がやっぱ違うんだなと思って。
1709080	1709400	そうですね。
1709580	1710640	イメージも違うんでしょうね。
1710700	1713840	だからプールといえば秋冬ってことなんですね。
1714220	1714380	ね。
1714960	1715800	面白かった。
1715960	1716100	うん。
1717260	1720520	そう、そこのアクアスパのとこで一個驚きだったのが、
1720520	1722420	結構古くはないんだけど、
1723220	1723340	あの、
1723340	1725860	男女着替える場所一緒で教養。
1726640	1726840	ほう。
1727320	1727620	そう。
1728000	1728920	あ、もちろんね、あの、
1729340	1732000	一人一人小部屋みたいな感じで行けるんだけど、
1732780	1734960	ロッカーとかは全部男女一緒。
1735400	1736100	へー。
1736360	1738000	うわ、初めて入ってこいとこと思って。
1738560	1739180	そうなんだ。
1739300	1743000	あ、でも本当に着替えるときにはその個室みたいなとこに行くってことですか?
1743320	1743540	うん。
1744440	1745420	でもおばあちゃんとか、
1746180	1749320	ロッカーの前で脱ぎ始めてたから。
1751480	1753060	カルチャーショックを受けた。
1753340	1756800	うん、もちろんね、若いご家族とか、
1757560	1759720	まあ、うちとかもね、もちろん子供たち含めて、
1759980	1762920	その、なんか部屋に入れて、そこで当然着替えて、
1763620	1767160	終わった状態で出てくるから、まあまあ別に見れる、見られることはないんだけど。
1767240	1767580	うんうん。
1768220	1773160	でも目の前のとこでロッカー教養で一緒に使うってすごいなんかめっちゃ珍しいなと思って。
1774860	1775880	ちょっとびっくりしました。
1776380	1776560	はい。
1777320	1777520	うん。
1778180	1782100	なんかそこも、サウナも基本男女混合で水着みたいな感じだから、
1782100	1783320	まあそこはね、プールだから、
1783340	1784520	そりゃそうなんですけど。
1785640	1790120	なんかちょっとだけ一瞬、その辺普通に気にせず許されてるのが、
1790160	1792600	日本だとね、交渉浴場法で絶対NGだけど。
1792920	1793540	あー、そっか。
1793900	1794060	はい。
1794400	1799920	海外だとその辺も許されて普通にやってんだっていうのに初めて来てみたかな。
1801180	1804740	なんかそういうサウナを楽しみつつ文化や、なんだろう、
1805220	1809040	そのサウナとかプールの立ち位置の違いなどをちょっと見てきた。
1809760	1810960	そんな時間でしたね。
1812460	1812820	なんか、
1813340	1817300	最近、ツイッターでなんか炎上してるのを見ましたけど、
1817920	1820060	戦闘を経営しているところの息子さんが、
1820780	1822220	なんか、その家と、
1823160	1824400	家の出入り口と、
1824680	1829060	えー、女性用のその更衣室が繋がってるらしくて、
1829520	1831900	そこを普通に出入りしてるとか言ってて。
1832400	1832560	え?
1833740	1834760	全然意味わかんないね。
1835440	1836420	え?日本だよね?
1836580	1837440	日本の話です。
1838000	1840440	40歳ぐらいのその息子さんが、
1841360	1843320	ちょいちょいそこを出入りして、
1843340	1848900	で、女性が結構びっくりしているっていうのを見ましたよ。
1849220	1850440	めちゃめちゃ意味わかんないね。
1850560	1850700	ね。
1851280	1851480	うん。
1851960	1854040	え、それなんか、やっぱ炎上してるよね、きっと。
1854240	1854960	まあ、そうですね。
1856500	1857940	それはそうだろって感じなんですけど、
1858000	1859260	でもなんか一定数こう、
1859880	1862840	なんかこれだから戦闘文化をわかってないやつは、
1862960	1864400	みたいなことを言ってる人もいて。
1864780	1866520	え、そっち寄りの人もいるんだ。
1866760	1868760	そっち寄りの人も結構いるんですよ。
1868800	1870320	はぁー、びっくりそれ。
1871320	1871620	うん。
1871620	1871900	うん。
1873340	1874520	そっち?
1878100	1883200	でもしょうがないというか、なんか昔から戦闘ってそういうもんだよね、みたいなふうに思ってるってこと?
1883400	1885960	うん、なんかそういう感じで言ってます。
1886260	1887300	言ってる人もいますね。
1887740	1888400	うんうんうんうん。
1888400	1890880	まあ、バンダイからは両方見えるやん、みたいな。
1891800	1893740	いや、でもそうだよね、今思ったら。
1893920	1898460	でもバンダイも一応、ついたてとか立ててますよね、多分女性側はね。
1898840	1899000	ね。
1899240	1900860	男の方は見えてますけど。
1900860	1902920	なんかおばちゃんがやってるなっていう場合もあるよね。
1903340	1904420	田舎とかだと。
1904520	1904660	うん。
1905680	1908640	まあ、女性、逆はね、普通にあるんですよね。
1908780	1910620	でも、おばちゃんとか普通に入ってきますもんね。
1910800	1912100	入ってくるー。
1912300	1914420	スーパー戦闘とかでもありますよね。
1914420	1920140	スーパー戦闘でも男性用の更衣室を女性のおばちゃんが掃除してるとか普通にある。
1920260	1920800	あるある。
1920960	1924160	今週西アザブのテルマー湯に行ってきたんですよ。
1924760	1925980	おばちゃん入ってきてたもん。
1926480	1931260	なんなら比較的、もう、あの、おばあちゃんではなく普通におばちゃんやで、みたいな。
1931280	1931500	うん。
1932680	1932960	うん。
1933340	1935960	普通に入ってきて、まあ、そうかーって思いながら。
1936140	1936300	ね。
1936420	1940280	あれにはちょっと慣れてしまったけど、まあ、うん、って感じですよね。
1940440	1941900	いいのみたいなのはあるよね。
1941980	1942120	ね。
1942240	1943720	ちょっとね、今、今ね。
1943980	1944140	うん。
1944460	1944820	うん。
1945140	1945820	確かに。
1946840	1962900	ちょっとそこって、昔はなんかあんまり気にしてなかったり、結構、子供もさ、あの、お父さんしかいないときには女の子のことをお風呂に入れたりとかあったなと思うけど、最近はより厳しく、厳しくというかこう、
1963340	1966340	うん。
1966340	1968340	うん。
1968340	1968920	うん。
1968920	1968960	うん。
1970640	1973780	先頭のそれとかって、先頭文化じゃねえじゃんって思うけど。
1973780	1975260	いや、そうっすよね。もはや。
1977940	1981100	文化と言えないよね。人の価値観が変わってるんだからさ。
1981340	1981580	うん。
1982360	1985360	うん。アップデートしなきゃいけない部分な気がするけどね。
1986180	1986660	なんかさ、
1986960	1987060	うん。
1987620	1992460	あの、いや、行くとき、俺、フランスに行くまで自明史見てたじゃん。
1993340	1993780	うん。
1993780	1996400	いや、これ関わるからちょっとだけ自明史の話しちゃうんだけどさ。
1996960	2001680	自明史でさ、あの、不動産の営業部長役の山本浩二さんがさ、
2001820	2001940	うん。
2002620	2006060	古いものなんてガンガン壊しちゃえばいいんだって言ってたシーン覚えてる?
2006160	2006880	あー、言ってましたね。
2006940	2016800	階段登りながら、古い、古いものなんて、みたいな。っていうのを言ってて、で、フランス来てじゃん。フランスの街並みめっちゃ古いもので。
2017100	2017620	うんうんうん。
2017880	2022780	建物とかさ、その価値観通じるのは日本だけなんだなとか。
2023340	2023740	うん。
2024460	2032860	こっちでさ、まあ、地震の話もあるけど、昔の、それこそエストニアのそういう建物とかって、あれ?何年前?
2033100	2042280	足利義満とかの時代に建てられてるって言ってたから、1300年代とかになる。1333年とかか。だから700年前とかに建てられてるわけよ。
2042460	2043680	うーん。すご。
2043680	2050980	そういうのを残して使ってたりとかさ、フランスの街とかなんて、そうじゃん。聖堂院とか大聖堂家とかさ。
2051900	2052900	うーん。ちょっと。
2053340	2068700	価値観をアップデートするのが正しいのか、残すものを残した方がいいのか、なんかなかなか。だってそういう、なんだろう、大聖堂とか伝統あるところとかはさ、きっと中の風習も昔のままとかもありそうじゃん。
2068940	2069240	うん。
2070000	2071460	難しいなって思った。
2072660	2079920	建物はね、特に日本の建物って結構壊しちゃいますよね。というか、あまり長持ちしないですよね、木造で。
2080140	2082340	うーん。だし、だいたい地震で壊れるよね。
2082460	2083240	ああ、まあ、それもある。
2083340	2085000	まあ、でもそうか、火事とね、地震とで。
